tanggal,keterangan,user_id,deskripsi_pekerjaan,divisi_id,jenis_pekerjaan_id,lokasi_id,foto_before,foto_after,tanggal_selesai,lead_time
2025-03-14,Internal,2.0,Penamblan ulang bak  pencucian kaki diproduksi,20,1,5.0,,,2025-03-14,
2025-03-14,Internal,5.0,"Bismillah, pengecekan instalasi jalur AC di area TSP",18,5,3.0,,,2025-03-14,
2025-03-14,Internal,5.0,"Bismillah, perbaikan instalasi jalur AC di ruang media sudah hidup kembali",18,5,3.0,,,2025-03-14,
2025-03-14,Internal,5.0,"Bismillah, izin untuk memindah kan colokan Wi-Fi,  colokan akuarium di ruang tengah office TSP",18,5,3.0,,,2025-03-14,
2025-03-14,Internal,2.0,Panasin mesin genset diho,20,4,5.0,,,2025-03-14,
2025-03-15,Internal,2.0,Bismilah penambalan yg bocor digudang tepung,20,1,1.0,,,2025-03-15,
2025-03-15,Internal,2.0,Bismilah penambalan yg bocor produksi tepung,20,1,1.0,,,2025-03-15,
2025-03-16,Internal,5.0,"Bismillah, penambalan bocoran di area atas parkiran TSP",18,1,3.0,,,2025-03-16,
2025-03-16,Internal,1.0,Lanjut perapihan sampah area ofies ciberem,20,1,1.0,,,2025-03-16,
2025-03-16,Internal,1.0,Membuang sampah dan membakar sampah,20,1,1.0,,,2025-03-16,
2025-03-16,Internal,1.0,Pemasangan MCB baru,20,5,1.0,,,2025-03-16,
2025-03-16,Internal,5.0,"Bismillah, proses penarikan instalasi jalur listrik untuk ruang admin",18,5,3.0,,,2025-03-16,
2025-03-16,Internal,5.0,"Bismillah, proses perbaikan mesin jahit tumpung",20,4,1.0,,,2025-03-16,
2025-03-17,Internal,5.0,"Bismillah, melanjutkan pengerjaan ruang admin",18,1,3.0,,,2025-03-17,
2025-03-17,Internal,1.0,Membersihkan pasir didepan pendopo diho,20,1,5.0,,,2025-03-17,
2025-03-17,Internal,5.0,"Bismillah, proses pemasangan rumah kunci",18,1,3.0,,,2025-03-17,
2025-03-17,Internal,5.0,"Bismillah, penutupan jendela ruang H'U/ruang admin sebelum proses dan sesudah",18,1,3.0,,,2025-03-17,
2025-03-17,Internal,5.0,Bismillah proses perbaikan talang air di samping ruang dir'op,18,1,3.0,,,2025-03-17,
2025-03-17,Internal,2.0,Lanjut perbaikan dan pengantian puli bawah dimesinA DKSSET1033,20,4,1.0,,,2025-03-17,
2025-03-17,Internal,5.0,"Bismillah, pengecekan AC di kemitraan yang bocor",4,7,3.0,,,2025-03-17,
2025-03-18,Internal,5.0,pembersiham area depan ruang admin yang baru ,18,1,3.0,,,2025-03-18,
2025-03-18,Internal,5.0,pemasangan instalasi jalur lampu dan stop kontak,18,5,3.0,,,2025-03-18,
2025-03-18,Internal,1.0,memanaskan genset ,20,4,5.0,,,2025-03-18,
2025-03-18,Internal,1.0,Perbaikan mesin setim,20,4,5.0,,,2025-03-18,
2025-03-18,Internal,1.0,pengecekan AC di area produksi HO,20,7,5.0,,,2025-03-18,
2025-03-19,Internal,5.0,plesteran lantai ruang admin ,18,1,3.0,,,2025-03-19,
2025-03-19,Internal,1.0,Pemasangan kotak obat,20,1,5.0,,,2025-03-24,
2025-03-19,Internal,1.0,pemasangan kotak p3k,20,4,1.0,,,2025-03-24,
2025-03-20,Internal,2.0,Perbaikan pipa air digudang cibereum,20,1,1.0,,,2025-03-20,
2025-03-20,Internal,5.0,"Bismillah, proses pengacian lantai ruang admin",18,1,3.0,,,2025-03-20,
2025-03-20,Internal,1.0,pengecekan listrik di ruang produksi ,20,5,1.0,,,2025-03-20,
2025-03-21,Internal,1.0,Perbaikan pipa air Sanyo gudang ciberem,20,1,1.0,,,2025-03-21,
2025-03-21,Internal,2.0,Pengelasan troli diho,20,1,5.0,,,2025-03-21,
2025-03-21,Internal,5.0,"Bismillah, proses pemasangan tirai dan benner di area parkiran KR2 di TSP",18,1,3.0,,,2025-03-21,
2025-03-21,Internal,2.0, ,20,1,1.0,,,2025-03-21,
2025-03-21,Internal,5.0, perapihan benner dan terpal  di area parkiran sebelum proses dan sesudah/selesai,18,1,3.0,,,2025-03-21,
2025-03-22,Internal,1.0,Beresin sampal yg mau d buang kemitraan lama,4,1,5.0,,,2025-03-22,
2025-03-22,Internal,1.0,membantu pindahan ke ciberum ,20,1,1.0,,,2025-03-22,
2025-03-22,Internal,5.0,"Bismillah, proses pengecatan ruang admin",18,1,3.0,,,2025-03-22,
2025-03-22,Internal,5.0,Kang egi sedang membantu pindahan di tsp ,18,1,3.0,,,2025-03-22,
2025-03-23,Internal,2.0,Lampu udah nyla kembali karenakn mcb kilo meter nya turunn,20,5,1.0,,,2025-03-23,
2025-03-24,Internal,1.0,Perbaikan mesin jahit,20,2,1.0,,,2025-03-24,
2025-03-24,Internal,5.0,perbaikan mesin jahit karung di Cibereum,20,2,1.0,,,2025-03-24,
2025-03-24,Internal,5.0,perbaikan mesin jahit karung di Cibereum,20,2,1.0,,,2025-03-24,
2025-03-24,Internal,1.0,Pemasangan plat moto,18,1,5.0,,,2025-03-24,
2025-03-24,Internal,1.0,Perbaikan 3 unit terminal mesin timbangan tepung,20,5,1.0,,,2025-03-24,
2025-03-24,Internal,9.0,Membantu pindahan dan memindahkan Terminal colokan dari ruang HRD lama ke ruang HRD baru,10,5,3.0,,,2025-03-24,
2025-03-24,Internal,1.0,Memperbaiki mesin tepung A,20,4,1.0,,,2025-03-24,
2025-03-24,Internal,1.0,Lanjut perbaikan mesin tepung E,20,4,1.0,,,2025-03-24,
2025-03-24,Internal,1.0,Lanjut perbaikan mesin F,20,4,1.0,,,2025-03-24,
2025-03-25,Internal,9.0,perakitan rak sepatu ,12,1,3.0,,,2025-03-25,
2025-03-25,Internal,5.0,Pemasangan kotak p3k,18,1,3.0,,,2025-03-25,
2025-03-25,Internal,1.0,Perbaikan gerbang utama ciberem,20,1,1.0,,,2025-03-25,
2025-03-25,Internal,1.0,Perbaikan pintu ciler,20,1,1.0,,,2025-03-25,
2025-03-25,Internal,2.0,Pegantian lampu diruangan pak alfian diho 2 pcs selesai,20,5,5.0,,,2025-03-25,
2025-03-25,Internal,5.0,peminisingan ruang admin selesai.,18,1,3.0,,,2025-03-25,
2025-03-25,Internal,2.0,Perbaikan dan pengantian steker ac diruangan pak alfian selesai dan udah nyla kembali,20,7,5.0,,,2025-03-25,
2025-03-25,Internal,1.0,Memperbaiki kursi yng patah tim. Produksi,20,1,5.0,,,2025-03-25,
2025-03-25,Internal,1.0,membongkar partisi di kantor ho ,20,1,5.0,,,2025-03-26,
2025-03-25,Internal,2.0,membongkar partisi di kantor ho ,20,1,5.0,,,2025-03-26,
2025-03-26,Internal,5.0,perbaikan intalasi listrik ,5,5,14.0,,,2025-03-26,
2025-03-26,Internal,2.0,perbaikan toren ,20,1,1.0,,,2025-03-26,
2025-03-25,Internal,10.0,pembuangan puing ,18,1,3.0,,,2025-03-26,
2025-03-23,External,3.0,"Freezer stokis babelan tidak dingin indikator suhunya di angka31°c, setelah di bersihkan masih tidak dingin dan keluar uap dari dalam freezer",3,2,7.0,,,2025-03-25,
2025-03-26,Internal,5.0, pencopotan rumah kunci di ruang legal & audit sebelum proses dan sesudah selesai,18,1,3.0,,,2025-03-26,
2025-03-26,Internal,5.0,pemasangan slot gembok untuk lemari ,18,1,3.0,,,2025-03-26,
2025-03-26,Internal,1.0,perbaikan mesin A,20,4,1.0,,,2025-03-26,
2025-03-26,Internal,2.0,Perbaikan mesinyg A DKASSET 1033,20,4,1.0,,,2025-03-26,
2025-03-27,Internal,5.0," penggantian kran air di kamar mandi office finance BRP, sebelum proses dan sesudah/selesa",5,1,14.0,,,2025-03-27,
2025-03-27,Internal,1.0, perbaikan jln digudamg cibereum,20,1,1.0,,,2025-03-27,
2025-03-27,Internal,2.0,Mengnti lampu yg putus digudang kering cibereum 1 pcs 18 watt,20,5,1.0,,,2025-03-27,
2025-03-28,Internal,2.0,perbaikan mesin steam ,20,4,5.0,,,2025-03-28,
2025-03-28,Internal,5.0,permanasan genset ,20,4,1.0,,,2025-03-28,
2025-03-28,Internal,2.0,perbaikan mesin jahit ,20,4,5.0,,,2025-03-28,
2025-03-28,Internal,5.0,perbaikan toilet ,20,1,1.0,,,2025-03-28,
2025-03-28,Internal,1.0,pengecekan dan pengukuran ,20,1,5.0,,,2025-03-28,
2025-03-28,Internal,1.0,perbaikan dril ,20,1,1.0,,,2025-03-28,
2025-03-28,Internal,1.0,perbaikan dril ,20,1,1.0,,,2025-03-28,
2025-03-28,Internal,1.0,perbaikan dril ,20,1,1.0,,,2025-03-28,
2025-03-28,Internal,5.0,pembersihan solokan ,20,1,1.0,,,2025-03-28,
2025-04-02,Internal,1.0,pengawasan proyek ,20,1,5.0,,,2025-04-02,
2025-04-03,Internal,1.0,pengawasan proyek ,20,1,5.0,,,2025-04-03,
2025-04-04,Internal,1.0,pengawasan proyek ,20,1,5.0,,,2025-04-04,
2025-04-05,Internal,1.0,pengawasan proyek ,20,1,5.0,,,2025-04-05,
2025-04-06,Internal,1.0,pengawasan perbaikan mesin blas,20,1,5.0,,,2025-04-06,
2025-04-08,Internal,1.0,pengukuran bersama vendor ,20,1,5.0,,,2025-04-08,
2025-04-08,Internal,2.0,perbaikan ac,20,1,5.0,,,2025-04-08,
2025-04-08,Internal,5.0,pemasangan ruter dan penarikan jalur listrik ,18,5,3.0,,,2025-04-08,
2025-04-08,Internal,5.0,pemasangan rumah kunci ,18,1,3.0,,,2025-04-08,
2025-04-08,Internal,5.0,pengecekan jalur panel ,5,5,14.0,,,2025-04-08,
2025-04-09,Internal,5.0,pembuatan ruangan skat di brp,5,1,14.0,,,2025-04-09,
2025-04-09,Internal,1.0,pengecetan kusen yang rusak ,18,1,1.0,,,2025-04-09,
2025-04-09,Internal,1.0,pencabutan jendela,20,1,5.0,,,2025-04-09,
2025-04-10,Internal,2.0,pemansan genset ,20,1,5.0,,,2025-04-10,
2025-04-10,Internal,5.0,pengecekan panel ,20,5,5.0,,,2025-04-10,
2025-04-10,Internal,5.0,pembuatan ruangan skat di brp,5,1,14.0,,,2025-04-10,
2025-04-10,Internal,2.0,pergantian kipas,18,1,1.0,,,2025-04-10,
2025-04-11,Internal,1.0,perbaikan mesin jahit,20,4,5.0,,,2025-04-11,
2025-04-11,Internal,5.0,pembuatan ruangan skat di brp,5,1,14.0,,,2025-04-11,
2025-04-11,Internal,1.0,perbaikan colokan ,20,5,5.0,,,2025-04-11,
2025-04-11,Internal,1.0,perbaikan intalasi listrilk,20,4,5.0,,,2025-04-11,
2025-04-12,Internal,5.0,Pemasangan terminal untuk ruang legal,18,5,14.0,,,2025-04-12,
2025-04-12,Internal,1.0,Pembuatan meja buat layar cctv,20,1,5.0,,,2025-04-12,
2025-04-12,Internal,5.0,Izin report perbaikan kipas angin oleh kang egi di stokis ciomas,3,4,7.0,,,2025-04-12,
2025-04-12,Internal,1.0,Pengecekan mesin thamler yg kendala,20,4,5.0,,,2025-04-12,
2025-04-13,Internal,2.0,Izin report pak untuk pengerjaan  drainase di eksekusi oleh pak iwan dan juga pak irawan ,20,1,5.0,,,2025-04-13,
2025-04-13,Internal,1.0,Izin report pak untuk pengerjaan  drainase di eksekusi oleh pak iwan dan juga pak irawan ,20,1,5.0,,,2025-04-13,
2025-04-13,Internal,1.0,mpo panel mesin thamler tuba tiba mati sedang dalam proses perbaikan,20,4,5.0,,,2025-04-13,
2025-04-14,Internal,5.0,"Bismillah,perapihan stopkontak diruang H'U Meja pak Paris, sebelum proses dan sesudah/selesai.",18,5,14.0,,,2025-04-14,
2025-04-14,Internal,1.0,Pemasangan cantel gembok gudang bumbu area parkir,18,1,5.0,,,2025-04-14,
2025-04-14,Internal,2.0,pembuatan skat ,5,1,14.0,,,2025-04-14,
2025-04-14,Internal,2.0,Memperbaiki cctv diruangan mesin diho,20,1,5.0,,,2025-04-14,
2025-04-14,Internal,1.0,Pembongkaran talang dan perapihan talang d office ciberem,20,1,1.0,,,2025-04-14,
2025-04-14,Internal,2.0,Penutupan samping area office ciberem,20,1,1.0,,,2025-04-14,
2025-04-15,Internal,1.0,Perbaikan mesin tepung F,20,1,1.0,,,2025-04-15,
2025-04-15,Internal,5.0,", melanjutkan pembuatan skatan ruang arsip",18,1,14.0,,,2025-04-15,
2025-04-15,Internal,1.0,Lanjut perbaikan mesin A,20,4,1.0,,,2025-04-15,
2025-04-15,Internal,5.0,", pengecekan breket stending tv div, Iven. Karena roda baut sudah selek/doll solusi nya harus di lass.",18,1,3.0,,,2025-04-15,
2025-04-15,Internal,1.0,Pembongkaran rak besi yang sempat tertunda karna perbaikan mesin,18,1,5.0,,,2025-04-15,
